{
  "$schema": "../../.modcreator/schema/block.json",
  "kind": "block",
  "id": "ruby_ore",
  "name": "Ruby Ore",
  "tags": ["minecraft:mineable/pickaxe", "minecraft:needs_iron_tool"],
  "creativeTab": "natural_blocks",
  "block": {
    "hardness": 3.0,
    "resistance": 3.0,
    "sound": "stone",
    "requiresTool": true,
    "model": { "type": "cube_all", "texture": "art/ruby_ore.png" }
  },
  "drops": { "item": "ruby", "min": 1, "max": 2, "fortune": true }
}
